{"artifact":"RUN_STATE","baseline":{"fingerprint_reason":"multi-repository task uses explicit repository revisions","fingerprint_status":"unavailable","revision":"4ac8ce9fffaa4a77e04fce435035f341767d6cf0","working_tree_fingerprint":null},"blocked_by":[],"context_deliveries":[{"consumer_role":"coder_a","content_hash":"sha256:cd2089253c6d9e5eba349130f50570b78b3d5103f5f2d02d43caaa9e73905d74","mode":"expanded","package_id":"FF-AI-OPS-001-active-006-context","paths":["openspec:operational-workflow-mvp","AGENTS.md","docs/SOURCE_OF_TRUTH.md"],"tokens":4565}],"current_state":"VALIDATING","last_error":null,"next_state":"REVIEWING","retry_counters":{"context":0,"implementation":0,"review":0},"review_history":[],"route_history":[{"hash":"sha256:dd2b34dd91aae75112ee040ed7cb9499bfe2c82bfc3719eaf2cb38111288974b","path":"artifacts/model-resolution.json","schema_version":"fitflow-model-resolution/v1"}],"run_id":"FF-AI-OPS-001-active-006","schema_version":"fitflow-run-state/v2","sequence":2,"task_id":"FF-AI-OPS-001","updated_at":"2026-08-26T16:18:56.204Z","validation_history":[],"workflow_id":"development"}
