{
  "artifact": "RUN_STATE",
  "schema_version": "fitflow-run-state/v2",
  "task_id": "FF-AUD-001",
  "run_id": "FF-AUD-001-20260825-01",
  "updated_at": "2026-08-25T11:17:05-03:00",
  "baseline": {
    "revision": "20d26166e5b5a4166eecf95833c18036aae6dc06",
    "fingerprint_status": "unavailable",
    "working_tree_fingerprint": null,
    "fingerprint_reason": "El bundle documental FF-AUD-001 fue el unico cambio del worktree durante el run."
  },
  "workflow_id": "documentation_sync",
  "current_state": "PENDING_ACCEPTANCE",
  "next_state": "DONE",
  "sequence": 7,
  "retry_counters": {
    "context": 0,
    "implementation": 0,
    "review": 3
  },
  "context_deliveries": [],
  "route_history": [],
  "validation_history": [
    {
      "path": ".ai/runs/FF-AUD-001-20260825-01/validation.json",
      "hash": "sha256:5d32e94491414a16147dd16e784eecc4f041064721b79316c34da86111d1c42c",
      "schema_version": "fitflow-validation-result/v2"
    }
  ],
  "review_history": [
    {
      "path": ".ai/runs/FF-AUD-001-20260825-01/review.json",
      "hash": "sha256:a72364a4aca84f58ead4ffb444a4f849776ee76cd91177bcf430b7b5b072c84d",
      "schema_version": "fitflow-review-result/v2"
    }
  ],
  "blocked_by": [],
  "last_error": null
}
